{
  "task_id": "task_article_excel_demo",
  "parent_task_id": null,
  "title": "Article batch to workbook",
  "objective": "Download the requested articles, extract study fields, and fill the Excel workbook.",
  "status": "queued",
  "priority": "high",
  "created_at": "2026-04-03T09:00:00Z",
  "updated_at": "2026-04-03T09:00:00Z",
  "requested_by": "user",
  "orchestrator": {
    "director": "openclaw",
    "router_version": "v1",
    "tool_profile": "default"
  },
  "classification": {
    "domain": "systematic_review",
    "risk": "medium",
    "execution_mode": "hybrid",
    "direct_resolve_allowed": false
  },
  "assigned_agent": null,
  "inputs": {
    "query": "batch article extraction",
    "files": [],
    "articles": [
      "/Users/diegoalejandroidarragalopez/.openclaw/media/inbound/fracturas_humero_proximal_revision---a5f65d80-8f61-409f-828f-90abeb19fd66.pdf"
    ],
    "excel_template": "/Users/diegoalejandroidarragalopez/.openclaw/media/inbound/Formulario_Extraccion_Datos_SR---ad9cfbaf-e502-4630-b330-59480b6ad7c1.xlsx"
  },
  "constraints": {
    "structured_output": true,
    "allow_parallel_subtasks": true,
    "must_save_pdfs": true
  },
  "plan": [],
  "artifacts": [],
  "subtasks": [],
  "fallbacks_used": [],
  "result": null,
  "error": null
}
